{
  "schemaVersion": 2,
  "id": "m01",
  "provenance": "LLM first draft \u00b7 human-edited once \u00b7 LLM novice pass \u00b7 human-reviewed",
  "conceptPageMarkdown": "## One call, or six\n\nSay you want the text out of a file. In C# you can write this:\n\n`var text = File.ReadAllText(path);`\n\nOne line. You did not pick a read buffer size. You did not work out whether the\nfile is UTF-8. You did not open a handle and remember to close it. Somebody\nwrote all of that once, and put it behind a door with one handle on it.\n\nNow picture the other version. Open the file. Ask what encoding it uses. Pick a\nbuffer size. Read chunk by chunk. Close the handle. Cope with closing failing.\nSame result. Six decisions you now own, in every place you read a file.\n\nThis Module is about the difference between those two, and how to end up with\nthe first one on purpose.\n\n## The trade every code module makes\n\nA **code module** is any piece of code you can call from outside: a class, a\nfile, a package. Kata also uses the word *Module* for a page like this one, so\nwhere both meanings are in play this page says *code module*.\n\nEvery code module has two sides.\n\n- Its **surface** is everything a caller must know to use it: method names,\n  parameters, configuration values, the order calls have to happen in, and what\n  it throws. A **caller** is any code that uses it.\n- Its **functionality** is everything it does for that caller.\n\nThe surface is the *cost*. Every caller pays it once to learn it, and pays\nagain each time it changes. The functionality is the *benefit*. So the goal has\na shape: hide as much work as possible behind as small a surface as possible.\n\n`File.ReadAllText(path)` is a **deep** code module. One thing to learn, and\nbuffering, encoding, handle lifetime, and platform differences all stay\nsomebody else's problem.\n\nA wrapper class whose five methods each forward to one call underneath is a\n**shallow** one. Its surface is nearly as large as its insides. It adds\nsomething to learn without removing anything to know.\n\nDepth is a ratio you can eyeball: *how much does this hide, per thing a caller\nmust learn?*\n\n## Information hiding\n\nSuppose your app saves notes to disk as JSON files, one per note, in a folder\nunder the user's home directory. That choice \u2014 JSON, one file each, that folder\n\u2014 is a **design decision**: a choice somebody had to make, that could have gone\nanother way.\n\nInformation hiding means each code module owns a few such decisions and keeps\nthem to itself. **Hidden** has a hard test. A decision is hidden when no caller\ncould tell if it changed.\n\nSo try it. Swap the JSON files for a SQLite database. If any caller has to be\nedited, the storage decision was never hidden. It had leaked out into the\ncallers, one piece at a time.\n\n## Leakage has three countable tells\n\nYou do not need taste to spot leakage. You can count it.\n\n1. **Pass-through values.** A **pass-through** is an argument a caller takes and\n   never uses itself \u2014 it only hands it onward. If `SaveNote` accepts a folder\n   path so it can give that path to the writer underneath, the folder decision\n   is living in the caller. Count them.\n2. **Required call order.** `Open`, then `Read`, then `Close`. The module's own\n   lifecycle has become a ritual the caller performs. Splitting code up this way\n   has a name: **temporal decomposition**, dividing by *when things happen*\n   instead of by *what stays hidden*. It reads naturally, and it leaks.\n3. **Duplicated knowledge.** The same format string, magic path, or constant\n   appears inside the module *and* in the code that calls it. Grep for it. Two\n   copies means two places to edit the day the decision changes.\n\n## Making a code module deeper\n\n- **Defaults over knobs.** Every parameter is surface. `Send(message)`, with a\n  sensible retry policy chosen inside, beats\n  `Send(message, retries, backoffMs, timeout)`. Pick a good default and the\n  question stops being asked.\n- **Somewhat general-purpose.** `Save(name, text)` outlives\n  `SaveQuarterlyReportAsCsv(...)`. The general shape usually has the smaller\n  surface, and it survives the next feature request.\n- **Pull complexity downward.** Better that one module is a little harder to\n  write than that twenty callers are each a little harder to write. The author\n  of the module pays once. Every caller pays forever.\n\n## Why this idea comes first\n\nMost named design principles fall out of one question: *what does this code\nmodule hide, and from whom?* Single responsibility and dependency inversion are\nboth answers to it. Read the other Modules in whatever order you like \u2014 this\nquestion sits under all of them.",
  "modelExamples": [
    {
      "before": "// Every caller knows the directory layout, the file naming\n// scheme, the encoding, and the create-before-write dance.\npublic class ReportWriter\n{\n    public void Write(\n        string baseDir,\n        string reportName,\n        string contents,\n        Encoding encoding)\n    {\n        var dir = Path.Combine(baseDir, \"reports\",\n            DateTime.UtcNow.ToString(\"yyyy-MM\"));\n        Directory.CreateDirectory(dir);\n        var path = Path.Combine(dir, reportName + \".txt\");\n        File.WriteAllText(path, contents, encoding);\n    }\n}\n\n// A caller \u2014 carrying decisions that are none of its business:\nvar writer = new ReportWriter();\nwriter.Write(\"C:/data\", \"q3-summary\", text, Encoding.UTF8);",
      "after": "// The directory layout, naming scheme, and encoding are\n// design decisions the store owns. Callers name a report\n// and hand over text; nothing else to know.\npublic class ReportStore\n{\n    private static readonly Encoding TextEncoding = Encoding.UTF8;\n    private readonly string _root;\n\n    public ReportStore(string root) => _root = root;\n\n    public void Save(string reportName, string contents)\n    {\n        var dir = Path.Combine(_root, \"reports\",\n            DateTime.UtcNow.ToString(\"yyyy-MM\"));\n        Directory.CreateDirectory(dir);\n        File.WriteAllText(\n            PathFor(dir, reportName), contents, TextEncoding);\n    }\n\n    private static string PathFor(string dir, string name) =>\n        Path.Combine(dir, name + \".txt\");\n}\n\n// A caller now:\nstore.Save(\"q3-summary\", text);",
      "caption": "The directory layout, file naming scheme, and encoding moved out of every call site and got hidden inside the store. Four things a caller had to know became one."
    },
    {
      "before": "// Temporal decomposition: the queue's internal lifecycle\n// is the caller's job, in the right order, every time.\npublic class JobQueue\n{\n    public void Connect(string host, int port) { /* ... */ }\n    public void Authenticate(string token) { /* ... */ }\n    public void Enqueue(Job job) { /* ... */ }\n    public void Flush() { /* ... */ }\n    public void Disconnect() { /* ... */ }\n}\n\n// Every caller repeats the same ritual:\nvar queue = new JobQueue();\nqueue.Connect(\"jobs.internal\", 5672);\nqueue.Authenticate(token);\nqueue.Enqueue(job);\nqueue.Flush();\nqueue.Disconnect();",
      "after": "// The connection lifecycle is hidden: opened on demand,\n// flushed and closed by the queue itself. One method,\n// no ordering rules for the caller to get wrong.\npublic class JobQueue\n{\n    private readonly QueueSettings _settings;\n    private Connection? _connection;\n\n    public JobQueue(QueueSettings settings) =>\n        _settings = settings;\n\n    public void Enqueue(Job job)\n    {\n        _connection ??= Connection.Open(_settings);\n        _connection.Send(job);\n        _connection.Flush();\n    }\n}\n\n// Every caller now:\nqueue.Enqueue(job);",
      "caption": "Connect, authenticate, flush, and disconnect stopped being the caller\u2019s ritual: the connection lifecycle got hidden behind Enqueue, and the required call order disappeared with it."
    },
    {
      "before": "// Config leakage: retry policy decisions ride through\n// every caller as parameters nobody upstream understands.\npublic class PriceClient\n{\n    public decimal GetPrice(\n        string symbol,\n        int maxRetries,\n        int delayMs,\n        bool useBackoff)\n    {\n        for (var attempt = 0; ; attempt++)\n        {\n            try { return FetchOnce(symbol); }\n            catch (HttpRequestException) when (attempt < maxRetries)\n            {\n                var wait = useBackoff\n                    ? delayMs * (attempt + 1)\n                    : delayMs;\n                Thread.Sleep(wait);\n            }\n        }\n    }\n}\n\n// Callers guess at values they have no basis to choose:\nvar price = client.GetPrice(\"MSFT\", 3, 200, true);",
      "after": "// The retry policy is the client's own design decision,\n// chosen once with a sensible default. The surface shrinks\n// to the one thing callers actually know: the symbol.\npublic class PriceClient\n{\n    private const int MaxRetries = 3;\n    private static readonly TimeSpan BaseDelay =\n        TimeSpan.FromMilliseconds(200);\n\n    public decimal GetPrice(string symbol)\n    {\n        for (var attempt = 0; ; attempt++)\n        {\n            try { return FetchOnce(symbol); }\n            catch (HttpRequestException) when (attempt < MaxRetries)\n            {\n                Thread.Sleep(BaseDelay * (attempt + 1));\n            }\n        }\n    }\n}\n\n// Callers state intent, not policy:\nvar price = client.GetPrice(\"MSFT\");",
      "caption": "Three retry-policy knobs became defaults the client owns: the decision got hidden, and the caller\u2019s parameter count dropped from four to one."
    }
  ],
  "exercises": [
    {
      "id": "m01-e1",
      "type": "refactor",
      "title": "Deepen a shallow document store",
      "concept": "Deep Modules & Information Hiding",